product_name,product_price,rating,global_review,past_month_order
"Baby Hair Clips CELLOT 50PCS Baby Girls Fully Lined Baby Bows Hair Pins Tiny 2"" Hair Bows Alligator Clips for Baby Girls Infants Toddlers in Pairs",12,4.7,1381,1000
"Itzy Ritzy Spiral Car Seat & Stroller Activity Toy; Includes Clinking Rings, Mirror and Textured Ribbons; Rainbow",24,4.7,14428,20000
Outlet Covers Baby Proofing (50 Pack) Safe & Secure Electric Plug Protectors | Sturdy Childproof Socket Covers for Home & Office | Easy Installation | Protect Toddlers & Babies | White,7,4.7,4120,5000
"FAREVER Baby Wipe Dispenser, 4 Pack Portable Refillable Wipe Holder, Reusable Lightweight Wipes Container Case Holder for Travel Wet Wipe Pouch, Floral",6,4.6,1764,600
"Konssy Muslin Baby Bibs 6 Pack Baby Bandana Drool Bibs Soft Cotton for Unisex Boys Girls, Absorbent Solid Colors Bibs",18,4.8,0,50
"Pigeon Breast Milk Storage Bag, Disposable Self Standing Bag, 5 Colourful Design, 50 Pcs (Pack of 2), 6 Oz",17,4.7,0,200
"ONE PIX Backseat Car Organizer Mats Back Seat Organizers and Storage Bag with Touch Screen Tablet Holder for Kids Toddlers Car Seats, Travel Accessories, Road Trip Essentials Kids",11,4.4,8093,1000
"Lutron Caseta Wireless Pedestal for Pico Smart Remote, L-PED1-WH, White",9,4.9,1524,500
Catchy - The Food and Mess Catcher for The Stokke Tripp Trapp - Catchy Food Catching Accessory for Highchairs - Baby & Toddler Food Mat - High Chair Food Catcher - High Chair Accessories,59,4.0,0,400
"hiccapop OmniBoost Travel Booster Seat with Tray for Baby, Dining Table, Camping, Beach, Grandma’s | Folding Portable Tip-Free Design Straps to Kitchen Chairs",39,4.8,23930,3000
Baby Spiral Hanging Stroller and Car Seat Toys for Babies 0-6 Months Newborn Plush Activity Toys for Bed Bassinet Crib Baby Carrier Gifts (Bee),15,4.2,0,1000
"Baby Grooming Kit, Infant Safety Care Set with Hair Brush Comb Nail Clipper Nasal Aspirator Ear Cleaner,Baby Essentials Kit for Newborn Girls Boys (Pink Baby Grooming kit)",12,4.5,0,500
"Univivi Door Hanging Organizer Nursery Closet Cabinet Baby Storage with 4 Large Pockets and 3 Small PVC Pockets for Cosmetics, Toys and Sundries (Grey)",26,4.7,9104,2000
"Dahey Headband Holder Bow Hanger for Girls Hair Bows, Macrame Headbands Hair Accessories Hanger Necklace Display with 30 Hooks Wall Hanging Over Door Organizer Boho Nursery Decor for Baby's Room",15,4.7,0,300
"hiccapop MiniPod Baby Dome for On the Go | Travel Baby Tent for Beach Protects from Sun, Wind, Bugs | Lightweight Portable Baby Bed, Baby Beach Tent for Baby | On the Go Baby Dome for Outside & Inside",84,4.6,0,100
"BOLOLO Portable Milk Warmer with Super Fast Charging and Cordless, Instant breastmilk, Formula or Water Warmer with 10 Ounces Big Capacity, Baby Flask for Vehicle,car,Airplane Journey",69,4.4,0,1000
Fumdonnie Cute Baby Boys Snowsuit New Born baby girls Winter Coat Toddler Clothes,27,4.6,1148,500
"b&h Digital Baby Thermometer, The Infant Baby Bath Floating Toy Safety Temperature Water Thermometer (Classic Duck)",16,4.6,7959,8000
"iPlay, iLearn 10pcs Baby Rattles Toys Set, Infant Grab N Shake Rattle, Sensory Teether, Development Learning Music Toy, Newborn First Birthday Gifts for 0 1 2 3 4 5 6 7 8 9 10 12 Month Babies Boy Girl",23,4.8,28753,3000
"NUK Comfy Orthodontic Pacifiers, 0-6 Months, Timeless Collection, 5 Count (Pack of 1)",9,4.6,29030,20000
"ULG 1 Pack Over Door Organizer with 5 Large Pockets 10 Mesh Side Pockets, 44 lbs Weight Capacity Hanging Storage Organizer with Clear Window Kids Toys, Shoes, Diapers, Dark Grey, 5 Layers",26,4.7,2040,3000
"hiccapop MiniPod Baby Dome for On the Go | Travel Baby Tent for Beach Protects from Sun, Wind, Bugs | Lightweight Portable Baby Bed, Baby Beach Tent for Baby | On the Go Baby Dome for Outside & Inside",84,4.6,0,100
"Portable Crib for Baby, Portable Baby Playpen with Detachable Bassinet and Changing Table",93,4.7,7621,1000
XMWEALTHY Unisex Infant Swaddle Blankets Soft Thick Fleece Knit Baby Girls Boys Stroller Wraps Newborn Baby Accessory Light Pink,23,4.7,6114,800
"Yxiang 30PCS Hair Ties for Toddler Girls, 3Inches Cute Soft Kid Hair Ties Colorful Elastic Rubber Band with Flowers Ponytail Holder for Baby Girls School Kids -15Pairs",9,4.5,0,100
"Baby Car Seat Cover, Infant Carseat Canopy with 3 Layers Windows, Breathable Mesh Peep Window, Kick-Proof Carrier Cover for Boys Girls, Windproof Stroller Cover Shower Gift for Newborn (Elephant)",18,4.6,0,10000
"Aveeno Baby Bathtime Solutions Baby & Me Gift Set with Baby Wash & Shampoo, Calming Baby Bath & Wash, Baby Daily Moisturizing Lotion & Stress Relief Body Wash for Mom, Soap-Free, 4 items",22,4.8,20023,50000
"Pampers Sensitive Water Based Hypoallergenic and Unscented Baby Wipes Combo, 1008 count (Packaging May Vary)",34,4.8,164940,1000
"Glad For Kids Disposable Paper Bibs, 30 Ct - Disposable Bibs - Travel Bibs For Kids, Disposable Kids Bibs With Crumb Catcher",9,4.4,0,100
"Baby Swaddle Set Newborn - Receiving Headband Blankets and Bow Hat,Newborn Essentials, Soft Nursery Swaddling Blankets，Stretchy Baby Blankets for Girls and Boys Unisex(Light Brown)",17,4.6,0,1000
"ADOVEL Baby Bassinet Bedside Crib, Pack and Play with Mattress, Diaper Changer and Playards from Newborn to Toddles, Grey",198,4.3,1753,100
"Rechargeable Baby Nail File, Fansidi Electric Baby Nail Trimmer for Newborn Infant or Toddler Toenail and Fingernail - Girls and Boys Accessory - Extra Replacement Pads Included (Pink)",22,4.5,20275,5000
"Dr. Brown’s Folding Baby Bottle Drying Rack for Easy Storage, Dry Nipples, Pacifiers and Other Baby Essentials, BPA-free",12,4.7,7294,5000
"6-Piece Silicone Feeding Spoons for First Stage Baby and Infant, Soft-Tip Easy on Gums I Training Spoon | Baby Utensils Feeding Supplies, Dishwasher & Boil-proof",8,4.9,0,900
"Simple Joys by Carter's Unisex Babies' Teething Bibs, Pack of 7",22,4.7,10318,10000
"Tushbaby - Safety-Certified Hip Seat Baby Carrier - Mom’s Choice Award Winner, Seen on Shark Tank, Ergonomic Carrier & Extenders for Newborns & Toddlers (Carrier, Grey)",84,4.7,3912,1000
"ALPINE Muffy Baby Ear Protection for Newborn and Babies up to 36 Months – Noise Reduction Earmuffs for Toddlers and Children – Comfortable Infant Ear Muffs Prevent Hearing Damage & Improve Sleep, Blue",29,4.4,21784,700
"The Peanutshell 7 in 1 Baby Play Gym, Activity Center and Tummy Time Mat, Woodland Animals",49,4.6,0,4000
Boon Cacti Bottle Cleaning Brush Set,16,4.8,25864,3000
"Simple Joys by Carter's Unisex Babies' Cotton Sleeper Gown, Pack of 3",28,4.8,16536,600
"Muslin Carseat Cover for Babies, Metplus Breathable Infant Carseat Cover Lightweight Baby Carrier Cover for Girls Boys, Fit Spring Summer/Hot Days/Warm Weather, Pink Floral",9,4.5,2658,800
"Simple Joys by Carter's Unisex Babies' Muslin burp cloths, Pack of 7, Grey/White/Black, One Size",23,4.7,35380,50
"2-Pack Baby Silicone Bibs, Waterproof, Easy Wipe Silicone Bib for Babies, Toddlers, Baby Feeding Bibs with Large Food Catcher Pocket, Travel Bibs for Baby Girl, Boy, Food Grade BPA Free (Cloud Nine)",11,4.7,5671,1000
"Burt's Bees Baby Baby Girls' Mittens, No-Scratch Mitts, 100% Organic Cotton, Set of 3",12,4.4,6350,1000
"Orighty Burp Cloths, Super Soft & Highly Absorbent Coral Fleece, 20 x 10 Inch Gentle & Large Burp Rugs for Baby Sensitive Skin - Burping Cloths for Newborn Essential, 8 Pack",7,4.8,0,400
"VISBL Baby Girl Headbands and Bows, Newborn Infant Toddler Nylon Hairbands Hair Accessories",12,4.7,1151,4000
Pamo Babe Portable Crib for Baby Nursery Center Playard Baby Playpen Travel Crib Diaper Changer with Mattress,104,4.3,5481,600
"Momcozy Baby Wrap Carrier Slings, Easy to Wear Infant Carrier Slings for Babies Girl and Boy, Adjustable Baby Carriers for Newborn up to 50 lbs, Black",32,3.9,8470,1000
IUMÉ Baby Crawling Pads Anti-Slip Knee Protect Baby’s Knee for Crawling,8,4.8,23854,2000
Touched by Nature Unisex Baby Organic Cotton Socks,10,4.5,2134,800
"1080P Baby Car Mirror, Shybaby 4.3'' Baby Car Camera Monitor 170° Wide View, HD Night Vision Function and Reusable Sucker Bracket, Safety Rear Facing Car Set Camera Infants Kids Toddlers Black",12,4.6,6941,100
"Ubbi On-The-Go Dual Pacifier Holder, Keep's Baby's Binkies Clean and Accessible, Portable for Travel, Diaper Bag Accessory Must Have for Newborns, Sage Green",38,4.5,18878,2000
"INSEN Pregnancy Body Pillow with Jersey Cover,C Shaped Full Body Pillow for Pregnant Women",5,4.5,3038,900
Hudson Baby unisex-baby Cotton and Polyester Bibs,14,4.8,0,5000
"Shandra Silicone Baby Feeding Set (12 pcs) - Baby Led Weaning Supplies - Baby Feeding Accessories - Suction Divided Plate, Plates and Bowls, Sippy Cup Straw & Lid, Bibs, Spoons, Forks (Pink)",24,4.7,12352,3000
"Parker Baby Diaper Caddy - Nursery Storage Bin and Car Organizer for Diapers and Baby Wipes - Large, Grey",24,4.5,3038,1000
"SeedFuture Baby Stroller Seat Supports Compatible with DOONA, Head and Body Support Pillow Pad Cushion, Stroller Accessories for DOONA, Grey",21,4.8,3493,100
Elesa Miracle 60pcs Baby Girl Mini Hair Claw Clips Flower Hair Bangs Pin Baby Girl Hair Accessories Clips,6,4.7,9570,2000
"Portable Baby Changing Pad, SKYROKU Detachable Travel Changing Pad, Smart Wipes Pocket with Built-in Pillow -Waterproof & Large Changing Area-Foldable Travel Baby Changing Kit(Grey)",117,,0,500
"BOLOLO Portable Milk Warmer with Super Fast Charging and Cordless, Instant breastmilk, Formula or Water Warmer with 10 Ounces Big Capacity, Baby Flask for Vehicle,car,Airplane Journey",13,4.8,20071,1000
"Huggies Natural Care Sensitive Baby Wipes, Unscented, Hypoallergenic, 99% Purified Water, 64 Count (Pack 0f 12) (768 Wipes Total)",69,,0,200
"Fisher-Price Portable Baby Chair Sit-Me-Up Floor Seat With Developmental Toys & Machine Washable Seat Pad, Honeydew Drop",22,4.7,0,1000
"HIPHOP PANDA Baby Washcloths, Rayon Made from Bamboo - 2 Layer Soft Absorbent Newborn Bath Face Towel - Natural Baby Wipes for Delicate Skin - Baby Registry as Shower(6 Pack)",42,,0,50000
"Maxi-Cosi 6-in-1 Minla High Chair, 6 Modes for Years of Growth, Essential Grey",11,4.4,0,3000
Baby Bather Plus - Bath Support with Thermometer for Bathtub or Sink (0-6 Months) Slip-Resistant & Ergonomic for Newborn Infant (Aqua) - Jool Baby,249,28.18,0,10000
"Baby Playpen with Mat 71 x 59 inch Baby Playpen for Babies and Toddlers, Extra Large Baby Playyard for Indoor & Outdoor Activity, with Soft Breathable Mesh for Kids Center",89,4.8,50984,500
"POPYJAN Baby Healthcare and Grooming Kit for Newborn Kids, 36PCS Upgraded Safety Care Kit, Nursery Health Set, Products Blue-18pcs",39,,0,400
"Fisher-Price Baby Portable Bassinet and Play Space On-the-Go Baby Dome with Developmental Toys and Canopy, Windmill",34,,0,1000
Baby Shusher The Sleep Miracle Sound Machine Rhythmic Human Voice Shushes Baby to Sleep Every Time The Quickest Way to Get Baby to Sleep,39,4.7,54719,4000
"Baby Wrist Rattle Socks and Foot Finder Set, Perfect Baby Toys for 0-12 Months Newborn Boys and Girls As Baby Shower Gifts, Garden Bug Series",109,,0,400
"VFOLO Baby Bath Seat, Infant Bath Seat, Have Temperature Display Bar and Non-Slip Soft Mat，3 Bath Toys, 4 Upgraded Suction Cups are More Stable, Babies Shower Chair for Babies 6 Months & Up",9,4.8,25458,500
"Pigeon Silicone Coating (Glass Inside/Silicone Outside) Nursing Bottle, Wide Neck, Streamlined Body, Natural Feel, Easy to Clean, Heat-Resistant, Flowers, 8.1 Oz",85,,0,600
"Baby Nail Clippers, 4-in-1 Safe Baby Nail Kit with Cute Case, Nail Clipper, Scissors, Tweezers, Nail File Set for Newborn, Infant, Toddler and Kids-Owl Green",34,,0,1000
"Aveeno Baby Eczema Therapy Moisturizing Cream, Natural Colloidal Oatmeal & Vitamin B5, Moisturizes & Relieves Dry, Itchy, Irritated Skin Due to Eczema, Paraben- & Steroid-Free, 12 fl. oz",13,4.7,1720,8000
"Bumco Baby Diaper Rash Cream Applicator - Baby Bum Brush Diaper Cream Spatula for Butt Paste Diaper Cream - Newborn Baby Essentials, Perfect for Baby Registry, Baby Shower Gifts - Gray",39,,0,1000
"Doli Yearning Upgrade Baby Bath Thermometer Room Temperature| Water Thermometer|Kids' Bathroom Safety Products| Baby Bath(Seal Shape)℃/℉, LCD",25,4.4,2249,50
BRBLUERISE Baby Bottle Sterilizer and Dryer 17L 4 in 1 UV Light Sanitizer UV Sterilizer Touch Screen Control Timing for Baby and Home,9,,0,200
"RUBOD Wooden Baby Walker, Baby Push Walker with Activity Center and Storage for Boys and Girls Learning to Stand and Walk",117,,0,200
Doli Yearning Upgrade Baby Bath Thermometer Flamingo Room Temperature| Water Thermometer|Kids' Bathroom Safety Products| Baby Bath,19,,0,4000
"Burt's Bees Baby - Burp Cloths, 5-Pack Extra Absorbent 100% Organic Cotton Drool Cloths",6,4.6,2215,2000
"Lupantte Baby Healthcare and Grooming Kit, 24 in 1 Baby Electric Nail Trimmer Set, Nursery Care Kit, Toddler Nail Clippers, Medicine Dispenser, Infant Comb, Brush, Baby Care Products",13,,0,3000
"Baby Sound Machine, Momcozy White Noise Machine for Baby Sleeping with Night Light, Toddler Sleep Trainer with 34 Soothing Sounds, Timer, App Remote Control, Personal Sleep Routine (Blue)",119,4.6,0,200
"Frida Baby Ultimate Baby Kit | The complete baby health & wellness, grooming, and teething kit",49,,0,500
"BEBECAN Teething Sticks for Babies 0-36 Months - Super Soft Silicone Teethers in 6 Vibrant Colors, Infant Teething Relief, Multicolored Teething Toys Baby Gift Teethers for Babies 6-12 Months",19,4.2,0,600
"Smily Mia Teething Toys for Babies 0-6 Months, Silicone Never-Drop Penguin Teethers for Babies, Hand Pacifier for Sucking Babies, Best Toy for Teething Baby, Teething Mitten for New Born, Grey",13,,0,500
"Orighty Baby Washcloths 50-Pack, Microfiber Coral Fleece Baby Face Towels, Soft and Absorbent Wash Cloths for Newborns, Infants and Toddlers, Gentle on Delicate Skin for Face Hands and Body, 7x9 Inch",15,,0,100
"Aveeno Baby Calming Comfort Bath & Lotion Set, Nighttime Baby Skin Care Products with Natural Oat, Lavender & Vanilla Scents, Paraben-, Phthalate- & Phenoxyethanol-Free, 2 Items",28,4.7,0,10000
"Miraloop Teething Toy for Baby 0-6, 12, 18 Months Infant, Jellydog Never Drop Food Grade Silicone Rocking Teether, Prevent Choking & Odorless, Less Dust and Hair Adhesion, Baby Gift, Mint Green",159,,0,400
"Ubbi Vertical Baby Bottle Drying Rack, Space Saving Countertop Drying Rack Baby Accessory, Taupe",39,,0,1000
"Jovow Baby Gym with Kick and Play Piano,Baby Play Mat Tummy Time Baby Activity Gym Mat with 5 Infant Learning Sensory for Baby, Music and Lights Boy or Girl Gifts for Newborn (Green)",99,4.5,0,700
"ICOPUCA Shopping Cart Cover for Baby, 2 in 1 cart Cover for Babies N high Chair Cover, Padded Grocery cart seat Cover for Baby Girl boy, with 1” Thick/Removable/Reversible Cushion, Grey;",6,,0,3000
"AVEENO BABY Calming Comfort Bath with Relaxing Lavender & Vanilla Scents, Hypoallergenic & Tear-Free Formula, Paraben- & Phthalate-Free, 18 Fl Oz (Pack of 1)",9,4.8,9766,100
Papablic Baby Bottle Electric Steam Sterilizer and Dryer,15,,0,800
"3 in 1 Baby Booger Remover and Baby Ear Cleaner Tool Baby Nose Cleaner with Soft Silicone End Dual Ear Wax and Snot Remover Safe Nasal Picker for Newborns Infants & Toddlers, BPA Free",16,4.3,19761,1000
BlueMello Baby Swaddle Blanket | Ultra-Soft Plush Essential for Infants 0-6 Months | Receiving Swaddling Wrap White | Ideal Newborn Registry and Toddler Boy Accessories | Perfect Baby Girl Shower Gift,19,,0,500
"Baby Playpen 79”×71"" with Mat, Extra Large Play Pen for Babies and Toddlers, No Gap Baby Fence Area with Breathable Mesh, Safety Baby Gate Playpen",11,,0,1000
"MINIBOO Hooded Baby Towel - Ultra-Soft and Hypoallergenic Rayon from Bamboo Baby Towels for Newborns, Infants, and Toddlers - Super Absorbent Baby Bath Towels",19,4.8,0,50
Nuby Ice Gel Teether Keys,30,,0,7000
"GROWNSY Nasal Aspirator for Baby, Electric Nose Aspirator for Toddler, Baby Nose Sucker, Automatic Nose Cleaner with 3 Silicone Tips, Adjustable Suctions, Music and Light Soothing Function (Blue)",28,4.5,0,3000
"Lictin Baby Healthcare and Grooming Kit, 26 in 1 Rechargeable Nail Trimmer Electric Set,Safe File with Auto Light, Newborn Nursery Health Care Portable Safety Set for Infant Toddlers Boys Girls, Grey",29,,0,10000
"YIVEKO Baby Nail Kit, 4-in-1 Baby Nail Care Set with Cute Case, Baby Nail Clippers, Scissors, Nail File & Tweezers, Baby Manicure Kit and Pedicure kit for Newborn, Infant, Toddler, Kids-Owl Green",11,4.6,0,500
"Nasal Aspirator for Baby, MOMYMUST Electric Baby Nose Cleaner with Self-Cleaning Function, Baby Nasal Aspirator with 3 Levels of Suction, Music and Light, 2 Nose-Tips, 60 Days Use Time",69,,0,1000
"UnbuckleMe Car Seat Buckle Release Tool - Easy Opener Aid for Arthritis, Long Nails, Older Kids - Button Pusher for Infant, Toddler, Convertible 5 pt Harness car Seats - As Seen on Shark Tank (Lime)",7,4.7,1280,100
"Orighty Muslin Baby Washcloths Pack of 6 - Soft Face Cloths for Newborn, Absorbent Baby Bath and Face Towels, 100% Cotton Baby Wipes, Burp Cloths, Feeding Towels for Babies and Infants - 10 x 10’’",9,,0,500
"Spotted Play 12 Pack Baby Washcloths - Extra Absorbent and Soft Wash Clothes for Newborns, Infants and Toddlers - Suitable for Baby Skin and New Born - Microfiber Coral Fleece 12x12 Inches",18,4.6,3965,10000
"[60 Pcs] Little Fox Baby Oral Cleaner +2 Pcs Finger Toothbrush with Cases, Baby Tongue Cleaner, Newborn Toothbrush, Disposable Tongue and Gum Cleaner, Infant Oral Care and Cleaning for 0-36 Month Baby",129,,0,1000
"HAUTURE Baby Bottle Sterilizer and Dryer, 6-in-1 Electric Steam Sterilizer for Baby Bottles, Pacifier, Breast Pump- Touch Screen & Auto-Off Bottle Sanitizer, White",19,4.8,5572,600
"Baby Changing Table with Wheels, Maydolly Portable Adjustable Height Folding Diaper Station with Nursery Organizer & Storage Rack for Newborn Baby and Infant (Dark Grey)",89,3.9,0,400
"VFOLO Baby Bath Seat, Infant Bath Seat, Have Temperature Display Bar and Non-Slip Soft Mat，3 Bath Toys, 4 Upgraded Suction Cups are More Stable, Babies Shower Chair for Babies 6 Months & Up",39,4.7,0,50
"miu Care Medical Grade Baby Nasal Aspirator Electric, Electric Nose Suction for Baby with 2 Silicone Tips, Battery Operated Nose Sucker with Cleaning Brush and Carrying Pouch",39,4.5,0,4000
Alpine Muffy Baby Ear Protection for Babies and Toddlers up to 36 Months - CE & ANSI Certified - Noise Reduction Earmuffs - Comfortable Headphones Against Hearing Damage & Improves Sleep - Green,29,4.4,21729,500
"Baby Playpen with Mat 71 x 59 inch Baby Playpen for Babies and Toddlers, Extra Large Baby Playyard for Indoor & Outdoor Activity, with Soft Breathable Mesh for Kids Center",109,4.7,0,3000
"Fisher-Price Portable Baby Chair Sit-Me-Up Floor Seat With Developmental Toys & Machine Washable Seat Pad, Honeydew Drop",42,4.7,54708,3000
Small photo album holds 24 4x6 photos,13,4.5,2668,1000
"Doli Yearning Upgrade Baby Bath Thermometer Room Temperature| Water Thermometer|Kids' Bathroom Safety Products| Baby Bath(Seal Shape)℃/℉, LCD",85,4.8,9761,3000
"Fisher-Price Baby Portable Bassinet and Play Space On-the-Go Baby Dome with Developmental Toys and Canopy, Windmill",19,4.6,28391,100
"Baby Nail Clippers 20 in 1 by Royal Angels | Safe Electric Baby Nail Trimmer, Baby Nail File Kit, Additional Replacement Heads, Newborn Toddler Toes and Fingernails, Trim and Polish (Pink)",159,4.2,0,1000
"Sense-U Smart 2K Video Baby Monitor, FSA&HSA Eligible, Pan/Tilt, Person/Baby Crying/Motion Detection, 2-Way Talk, Night Vision, Background Audio, No Monthly Fee (Compatible with Smart Baby Monitor)",39,4.6,2204,400
"HEYVALUE Baby Food Maker, 13-in-1 Baby Food Processor Gift Sets for Baby Food, Fruit, Vegatable, Meat, with Baby Food Containers, Baby Food Freezer Tray, Silicone Spoons, Silicone Spatula (Gray)",39,4.2,0,5000
Baby Bather Plus - Bath Support with Thermometer for Bathtub or Sink (0-6 Months) Slip-Resistant & Ergonomic for Newborn Infant (Aqua) - Jool Baby,13,4.6,0,9000
Munchkin® Shhh…™ Portable Baby Sleep Soother White Noise Sound Machine and Night Light,34,4.4,19747,2000
Hatch Rest Go | Portable Sound Machine for Babies and Kids | Baby Sleep Soother | 10 Soothing Sounds | White Noise | Shush | Travel | Registry Gift | Baby Shower | Clips on Baby Stroller | Slate,34,4.8,2753,500
Baby Shusher The Sleep Miracle Sound Machine Rhythmic Human Voice Shushes Baby to Sleep Every Time The Quickest Way to Get Baby to Sleep,249,4.7,1716,500
"Maxi-Cosi 6-in-1 Minla High Chair, 6 Modes for Years of Growth, Essential Grey",44,4.4,0,1000
"Baby Play Mat, Soft Foam Play Mats for Floor, Foldable Waterproof Playmats for Babies and Toddlers Kids, Reversible Baby Crawling Mat for Indoor and Outdoor, Tropical Boho Geometric Design, 79''x51''",29,4.5,0,50
"RowinsyDD 32 Pack Glass Baby Food Storage Containers, 4 oz Leakproof Baby Food Jars with Lids, Small Glass Food Containers for Infant Baby Food, Freezer & Microwave Safe, BPA Free",26,4.5,0,900
"Baby Grooming Kit, Infant Safety Care Set with Baby Electric Nose Aspirator，Baby Hair Brush Comb Nail Clipper Nasal Aspirator Ear Cleaner,Baby Essentials Kit for Newborn Girls Boys (21 Pc Green Kit)",6,4.8,2261,8000
"Bumco Baby Diaper Rash Cream Applicator - Baby Bum Brush Diaper Cream Spatula for Butt Paste Diaper Cream - Newborn Baby Essentials, Perfect for Baby Registry, Baby Shower Gifts - Gray",11,4.8,17443,800
"Miraloop Teething Toy for Baby 0-6, 12, 18 Months Infant, Jellydog Never Drop Food Grade Silicone Rocking Teether, Prevent Choking & Odorless, Less Dust and Hair Adhesion, Baby Gift, Mint Green",21,4.7,2954,100
Safety 1st Deluxe 25-Piece Baby Healthcare and Grooming Kit (Arctic Blue),15,4.8,4755,100
"Orighty Baby Washcloths 50-Pack, Microfiber Coral Fleece Baby Face Towels, Soft and Absorbent Wash Cloths for Newborns, Infants and Toddlers, Gentle on Delicate Skin for Face Hands and Body, 7x9 Inch",33,4.6,0,100
"Koalababy Large Flow Electric Nasal Aspirator, 2023 Newest Nose Sucker for Baby, Booger Sucker, Nose Cleaner for Toddlers with 3 Silicone Tips, 3 Suction Levels, Music & Light Soothing Function",129,4.2,0,200
"Baby Playpen 79”×71"" with Mat, Extra Large Play Pen for Babies and Toddlers, No Gap Baby Fence Area with Breathable Mesh, Safety Baby Gate Playpen",59,4.3,0,1000
"5 in 1 Thick and Plush Play Gym, Tummy Time Mat, Play Mat for Babies and Toddlers, Activity Gym, Baby Activity Center from Baby to Toddler, Ball Pit, Soft Plush Pet Bed, with 5 Toys(Beige)",39,4.6,0,2000
"iHealth Digital Ear Thermometer, Fast, Accurate, Gentle Results in 1 Second, Infrared, Pre-Warmed Tip with 21 Disposable Lens Filters & Organizer Case for Kids, Babies, Toddlers & Adults Home Use PT5",6,4.7,0,50
"BEBECAN Teething Sticks for Babies 0-36 Months - Super Soft Silicone Teethers in 6 Vibrant Colors, Infant Teething Relief, Multicolored Teething Toys Baby Gift Teethers for Babies 6-12 Months",19,4.5,0,10000
"Sense-U Organic Baby Swaddle Sleep Sacks - Floral Design, Ergonomic Design, Soft & Cozy Newborn Infant Adjustable Swaddle Blanket Wrap (0-3 Months)",3,4.8,1727,500
"Baby Bath Brush, JEXCULL Baby Cradle Cap Brush for Babies Newborns Premium Silicone Baby Scalp Scrubber Massage Exfoliator Brush Multifunctional Baby Bath Essentials",15,4.6,8221,600
"LaPettieCo Handmade Baby Headbands Stretchy Nylon Headband with Bows for Infant Baby Toddler Girls- Pack of 10, Colorful, 5 x 5 x 0.7 inches",15,4.8,0,600
"Baby Bath Books, Nontoxic Fabric Soft Baby Cloth Books, Early Education Toys, Waterproof Baby Books for Toddler, Infants Perfect Shower Toys, Kids Bath Toys Birthday Gift (Pack of 8)",49,4.7,104064,100
"Baby Play Mat Activity Gym - Tummy Time Mat for Babies 0-6 Months with 15 Activities, Machine Washable, 850 X 760mm Floor Play Space - Ideal for Infant Development & Baby Shower Gifts",4,4.4,0,10000
Nuby Ice Gel Teether Keys,25,4.9,11553,1000
"Nasal Aspirator for Baby, MOMYMUST Electric Baby Nose Cleaner with Self-Cleaning Function, Baby Nasal Aspirator with 3 Levels of Suction, Music and Light, 2 Nose-Tips, 60 Days Use Time",30,4.4,0,300
"Jovow Baby Gym with Kick and Play Piano,Baby Play Mat Tummy Time Baby Activity Gym Mat with 5 Infant Learning Sensory for Baby, Music and Lights Boy or Girl Gifts for Newborn (Green)",129,4.2,0,500
"Baby Playpen 79”×71"" with Mat, Extra Large Play Pen for Babies and Toddlers, No Gap Baby Fence Area with Breathable Mesh, Safety Baby Gate Playpen",39,4.4,2658,1000
"Baby Sound Machine, Momcozy White Noise Machine for Baby Sleeping with Night Light, Toddler Sleep Trainer with 34 Soothing Sounds, Timer, App Remote Control, Personal Sleep Routine (Blue)",18,4.7,4736,3000
BlueMello Baby Swaddle Blanket | Ultra-Soft Plush Essential for Infants 0-6 Months | Receiving Swaddling Wrap White | Ideal Newborn Registry and Toddler Boy Accessories | Perfect Baby Girl Shower Gift,117,4.6,3963,700
"Amazon Basics Portable Foldable Photo Studio Box with LED Light, 1 Count (Pack of 1), Black, 25 x 30 x 25 Inches",19,4.8,1577,400
"MINIBOO Rayon from Bamboo Hooded Baby Towel – Ultra Soft and Super Absorbent Baby Bath Towels for Newborns, Infants and Toddlers – Suitable as Baby Gifts",42,4.3,11200,3000
"GROWNSY Nasal Aspirator for Baby, Electric Nose Aspirator for Toddler, Baby Nose Sucker, Automatic Nose Cleaner with 3 Silicone Tips, Adjustable Suctions, Music and Light Soothing Function (Blue)",16,4.8,9664,10000
"Aveeno Baby Calming Comfort Bath & Lotion Set, Nighttime Baby Skin Care Products with Natural Oat, Lavender & Vanilla Scents, Paraben-, Phthalate- & Phenoxyethanol-Free, 2 Items",9,4.5,0,800
"POPYJAN Baby Healthcare and Grooming Kit for Newborn Kids, 36PCS Upgraded Safety Care Kit, Nursery Health Set, Products Blue-18pcs",99,4.8,2217,3000
"Frida Baby Ultimate Baby Kit | The complete baby health & wellness, grooming, and teething kit",69,4.7,11783,1000
Papablic Baby Bottle Electric Steam Sterilizer and Dryer,49,4.8,29756,2000
