product_name,product_price,rating,global_review,past_month_order
Fisher-Price Baby Bouncer Rainforest Jumperoo Activity Center with Music Lights Sounds and Developmental Toys,117,4.8,20067,1000
"Frida Baby Infrared Thermometer 3-in-1 Ear, Forehead + Touchless for Babies, Toddlers, Adults, and Bottle Temperatures,Digital",49,4.5,3248,10000
Yookidoo Baby Bath Shower Head - Elephant Water Pump with Trunk Spout Rinser - Control Water Flow from 2 Elephant Trunk Knobs for Maximum Fun in Tub or Sink for Newborn Babies(Pink),24,4.4,15504,2000
"HIPHOP PANDA Hooded Towel - Rayon Made from Bamboo, Soft Bath Towel with Bear Ears for Babie, Toddler, Infant - Ultra Absorbent, Baby Stuff Shower Gifts for Boy and Girl - (Bear, 30 x 30 Inch)",12,4.8,11662,10000
"Momcozy Warming Lactation Massager 2-in-1, Soft Breast Massager for Breastfeeding, Heat + Vibration Adjustable for Clogged Ducts, Improve Milk Flow, Blue-Green",77,4.7,2497,3000
"RUVALINO Diaper Bag Backpack, Multifunction Travel Back Pack Maternity Baby Changing Bags, Large Capacity, Waterproof and Stylish, Gray",29,4.4,3770,1000
"Infantino Flip Advanced 4-in-1 Carrier - Ergonomic, convertible, face-in and face-out front and back carry for newborns and older babies 8-32 lbs",42,4.8,34170,5000
Frida Baby Medi Frida the Accu-Dose Pacifier Baby Medicine Dispenser,28,4.6,65590,10000
"iHealth No-Touch Forehead Thermometer, Digital Infrared Thermometer for Adults and Kids, Touchless Baby Thermometer, 3 Ultra-Sensitive Sensors, Large LED Digits, Quiet Vibration Feedback, Non Contact",12,4.8,17872,10000
"Portable Diaper Changing Pad, Portable Changing pad for Newborn Girl & Boy - Baby Changing Pad with Smart Wipes Pocket – Waterproof Travel Changing Kit - Baby Gift by Kopi Baby",22,4.4,167830,40000
"Breast Pump, Wearable Breast Pump, Hands Free Breast Pump, 2 Mode & 5 Levels, 24mm Flange, 2 Pack",25,4.8,5675,9000
"Aveeno Baby Welcome Little One Gift Basket, Baby Skincare Set with Baby Body Wash & Shampoo, Calming Bath Wash, All Over Baby Wipes, & Daily Moisturizing Lotion, 5 Items",27,4.2,1368,1000
"Infinno Inflatable Tummy Time Mat Premium Baby Water Play Mat for Infants and Toddlers Baby Toys for 3 to 24 Months, Strengthen Your Baby's Muscles, Portable",69,4.8,0,2000
"haakaa Baby Nail Trimmer Electric Safe Baby Nail Clippers Baby Nail File Kit Manicure Set, Trim Polish Grooming kit for Newborn Toddler or Adults Toes Fingernails, 6 Grinding Heads and LED Light",23,4.4,20266,10000
"Contoured Changing Pad - Waterproof & Non-Slip, Includes a Cozy, Breathable, & Washable Cover - Jool Baby (Gray)",13,4.5,11054,7000
"Tiny Twinkle Mess Proof Baby Bib - Waterproof Baby Apron - Machine Washable - PVC, BPA, & Phthalate Free - Great Travel Bib…",18,4.8,2445,7000
"BOLOLO Portable Milk Warmer with Super Fast Charging and Cordless, Instant breastmilk, Formula or Water Warmer with 10 Ounces Big Capacity, Baby Flask for Vehicle,car,Airplane Journey",34,4.8,5577,1000
"Vivvi & Bloom Gentle 2-in-1 Baby Lotion, Face and Body, for Delicate & Sensitive Baby Skin, Hypoallergenic Lotion Natural Scent, 8.5 oz (Pack of 1)",9,4.4,0,1000
"10 Pack Furniture Anchors for Baby Proofing, Anti-Tip Wall Anchors Straps for Furniture Protect Toddler Children and Pet from Falling Furniture Cabinet Bookshelf Dresser, Earthquake Proof",69,4.7,0,400
Baby Einstein 4-in-1 Kickin' Tunes Music and Language Play Gym and Piano Tummy Time Activity Mat,9,4.8,0,500
Munchkin® Shhh…™ Portable Baby Sleep Soother White Noise Sound Machine and Night Light,7,4.7,19155,7000
Parker Baby Diaper Caddy - Nursery Storage Bin and Car Organizer for Diapers and Baby Wipes - Grey,44,4.4,5652,3000
"Aveeno Baby Bathtime Solutions Baby & Me Gift Set with Baby Wash & Shampoo, Calming Baby Bath & Wash, Baby Daily Moisturizing Lotion & Stress Relief Body Wash for Mom, Soap-Free, 4 items",13,4.7,12332,7000
VIKOS Products Toy Bar for Baby Bouncer - Googly Eyes Toy Plays Music and Balls Make Tinkling Sounds - Baby-Safe Plastic Baby Bouncer Toys - Easy to Install Baby Bouncer Accessory,19,4.8,20014,10000
"Coolplay Baby's First Non-Toxic Soft Cloth Book Set, Crinkle Books Friction with Rustling Sound - Pack of 8",22,3.7,0,300
"Aveeno Baby Welcome Little One Gift Basket, Baby Skincare Set with Baby Body Wash & Shampoo, Calming Bath Wash, All Over Baby Wipes, & Daily Moisturizing Lotion, 5 Items",16,4.6,5227,100
"Pamo Babe Portable Baby Playpen, Baby playard for Toddlers,Portable Crib with Storage Bag (Grey)",13,4.8,0,2000
"Nasal Aspirator for Baby, Electric Baby Nose Sucker with Adjustable 3 Levels Suction, Rechargeable Booger Sucker for Babies with 8 Light Modes and 3 Nursery Rhymes",23,4.5,0,100
Yoofoss Muslin Burp Cloths for Baby 10 Pack 100% Cotton Baby Washcloths for Boys Girls Large 20''X10'' Super Soft and Absorbent White,55,4.3,2065,2000
Baby Infant Rattle Socks Toys 3-6 to 12 Months Girl Boy Learning Toy,29,4.7,20296,5000
"X-Bosak Baby Nasal Aspirator, Electric Nose Sucker with 5 Levels Suction, Soothing Light & Nursery Rhymes",18,4.6,6796,8000
"AMAZKRUS Nasal Aspirator for Baby, Baby Essentials,Nose Suction for Baby, Baby Nasal Aspirator, Automatic Nose Cleaner with 3 Silicone Tips, Electric Nose Suction for Baby",12,4.7,0,1000
"KELLODY Baby Head Protector Cushion Toddler Backpack, Baby Safety Products for Toddler Baby Head Protection for Crawling & Walking",29,4.3,0,200
"Frida Baby The 3-Step Cradle Cap System | DermaFrida The FlakeFixer | Sponge, Brush, Comb and Storage Stand for Babies with Cradle Cap",31,4.5,0,20000
Frida Baby Control The Flow Polypropylene ABS Rinser|Bath Time Rinse Cup with Easy Grip Handle and Removable Rain Shower,18,4.8,28363,10000
"3-Pack Organic Baby Swaddle Sleep Sacks - Newborn Swaddle Sack, Ergonomic Baby Swaddles 0-3 Months, Swaddles for Newborns, Baby Sleep Sack, Baby Swaddle Blanket Wrap, Baby Essentials (Nordic)",14,4.7,7533,5000
"4-Pack Silicone Pacifier Clips with One-Piece Beads for Baby Boys and Girls - Flexible and Rust-Free Holders for Teething Relief and Baby Essentials, Safe for Newborns (Grey)",7,4.6,3400,7000
"EASICUTI Baby Tongue Cleaner, Baby Toothbrush, 42Pcs Disposable Infant Toothbrush Clean Baby Mouth,Gauze Gum Cleaner Baby Oral Cleaning Stick Dental Care for 0-36 Month Baby+Free 1 Finger Toothbrush",25,4.4,0,3000
"Baby Proof Kit, 58 Packs Baby Proofing Kit Essentials Child Proofing Appliance with Cabinet Locks, Corner Guards and Outlet Covers - All-in-one Super Value Child Proof Kit",9,4.6,4731,700
"Lansinoh Breastfeeding Essentials for Nursing Moms: Nipple Cream, 48 Nursing Pads, 25 Breastmilk Storage Bags, 2 Hot & Cold Breast Therapy Packs, Silicone Breast Pump, 77 Pieces",9,4.2,2522,2000
"Pro Goleem Elephant Security Blanket, Soft Lovey Unisex Lovie Baby Gifts for Newborn Boys and Girls Snuggle Toy Stuffed Animal Grey 16 Inch",29,4.7,0,6000
"LaPettieCo Handmade Baby Headbands Stretchy Nylon Headband with Bows for Infant Baby Toddler Girls- Pack of 10, Colorful, 5 x 5 x 0.7 inches",42,4.8,17133,1000
"Water Warmer, HEYVALUE Baby Bottle Warmer, Formula Maker with Night Light, 4 Temperature Control & 72H Keep Warm, Detachable Tank, Instantly Dispenses Warm Water, Feed Baby More Easier and Healthier",13,4.8,1727,3000
"Frida Baby Baby Basics Kit|Includes NoseFrida, NailFrida, Windi, DermaFrida + Silicone Carry Case",15,4.6,1988,7000
"Shynerk Baby Car Mirror, Safety Car Seat Mirror for Rear Facing Infant with Wide Crystal Clear View, Shatterproof, Fully Assembled, Crash Tested and Certified",44,4.8,3573,20000
"VTech VM819 Video Baby Monitor with 19 Hour Battery Life, 1000ft Long Range, 2.8” Display, Auto Night Vision, 2Way Audio Talk, Temperature Sensor and Lullabies,480p",39,4.7,27474,4000
"Dreamegg White Noise Machine - Portable Sound Machine for Baby Adult, Features Powerful Battery, 21 Soothing Sound, Noise Canceling for Office & Sleeping, Sound Therapy for Home, Travel, Registry Gift",18,4.6,6552,10000
"Pampers Aqua Pure Sensitive Baby Wipes , 672 count",59,4.7,3099,30000
Black and White High Contrast Baby Toys 0-6 6-12 Months Soft Book for Newborn Brain Development Tummy Time Toys Infant Sensory Crinkle Toys 0-3 3-6 Month Montessori Learning Activities for Babies,21,4.8,17036,8000
Yeeeasy Tummy Time Water Mat 丨Water Play Mat for Babies Inflatable Tummy Time Water Play Mat for Infants and Toddlers 3 to 12 Months Promote Development Toys Cute Baby Gifts,33,4.7,0,10000
"NUK Comfy Orthodontic Pacifiers, 0-6 Months, Timeless Collection, 5 Count (Pack of 1)",13,4.3,2524,20000
Alpine Muffy Baby Ear Protection for Babies and Toddlers up to 36 Months - CE & ANSI Certified - Noise Reduction Earmuffs - Comfortable Headphones Against Hearing Damage & Improves Sleep - Green,8,4.6,28997,4000
"Doli Yearning Upgrade Baby Bath Thermometer Room Temperature| Water Thermometer|Kids' Bathroom Safety Products| Baby Bath(Seal Shape)℃/℉, LCD",8,4.4,21728,3000
"b&h Baby Thermometer, The Infant Baby Bath Floating Toy Safety Temperature Water Thermometer (Classic Duck)",29,4.5,2668,8000
"Cetaphil Baby Wash & Shampoo Plus Body Lotion, Healthy Skin Essentials, Head to Toe Hydration for up to 24 Hours, for Delicate, Sensitive Skin, 2-Pack,White",13,4.6,7947,10000
"Huggies Natural Care Sensitive Baby Wipes, Unscented, Hypoallergenic, 99% Purified Water, 12 Flip-Top Packs (768 Wipes Total)",16,4.8,9049,50000
"Yoofoss Hooded Baby Towels for Newborn 2 Pack 100% Muslin Cotton Baby Bath Towel with Hood for Babies, Infant, Toddler and Kids, Large 32x32Inch, Soft and Absorbent Newborn Essential",15,4.8,50936,5000
"Baby Playpen with Mat 71 x 59 inch Baby Playpen for Babies and Toddlers, Extra Large Baby Playyard for Indoor & Outdoor Activity, with Soft Breathable Mesh for Kids Center",22,4.8,1457,500
"Univivi Door Hanging Organizer Nursery Closet Cabinet Baby Storage with 4 Large Pockets and 3 Small PVC Pockets for Cosmetics, Toys and Sundries (Grey)",19,4.7,0,2000
"Ubbi Vertical Baby Bottle Drying Rack, Space Saving Countertop Drying Rack Baby Accessory, Taupe",109,4.7,9094,1000
"Konssy Muslin Baby Bibs 6 Pack Baby Bandana Drool Bibs Soft Cotton for Unisex Boys Girls, Absorbent Solid Colors Bibs",18,4.8,0,50
"Pigeon Breast Milk Storage Bag, Disposable Self Standing Bag, 5 Colourful Design, 50 Pcs (Pack of 2), 6 Oz",17,4.7,0,200
"hiccapop MiniPod Baby Dome for On the Go | Travel Baby Tent for Beach Protects from Sun, Wind, Bugs | Lightweight Portable Baby Bed, Baby Beach Tent for Baby | On the Go Baby Dome for Outside & Inside",84,4.6,0,100
"ONE PIX Backseat Car Organizer Mats Back Seat Organizers and Storage Bag with Touch Screen Tablet Holder for Kids Toddlers Car Seats, Travel Accessories, Road Trip Essentials Kids",11,4.4,8093,1000
"Lutron Caseta Wireless Pedestal for Pico Smart Remote, L-PED1-WH, White",9,4.9,1524,400
Catchy - The Food and Mess Catcher for The Stokke Tripp Trapp - Catchy Food Catching Accessory for Highchairs - Baby & Toddler Food Mat - High Chair Food Catcher - High Chair Accessories,59,4.0,0,3000
YEYA Upgrade No Drill Anti Tip Furniture Anchor,39,4.8,23930,1000
"hiccapop OmniBoost Travel Booster Seat with Tray for Baby, Dining Table, Camping, Beach, Grandma’s | Folding Portable Tip-Free Design Straps to Kitchen Chairs",15,4.2,0,500
Baby Spiral Hanging Stroller and Car Seat Toys for Babies 0-6 Months Newborn Plush Activity Toys for Bed Bassinet Crib Baby Carrier Gifts (Bee),12,4.5,0,2000
"Baby Grooming Kit, Infant Safety Care Set with Hair Brush Comb Nail Clipper Nasal Aspirator Ear Cleaner,Baby Essentials Kit for Newborn Girls Boys (Pink Baby Grooming kit)",26,4.7,9104,300
"Univivi Door Hanging Organizer Nursery Closet Cabinet Baby Storage with 4 Large Pockets and 3 Small PVC Pockets for Cosmetics, Toys and Sundries (Grey)",15,4.7,0,100
"Dahey Headband Holder Bow Hanger for Girls Hair Bows, Macrame Headbands Hair Accessories Hanger Necklace Display with 30 Hooks Wall Hanging Over Door Organizer Boho Nursery Decor for Baby's Room",84,4.6,0,8000
"hiccapop MiniPod Baby Dome for On the Go | Travel Baby Tent for Beach Protects from Sun, Wind, Bugs | Lightweight Portable Baby Bed, Baby Beach Tent for Baby | On the Go Baby Dome for Outside & Inside",16,4.6,7959,3000
"b&h Digital Baby Thermometer, The Infant Baby Bath Floating Toy Safety Temperature Water Thermometer (Classic Duck)",23,4.8,28753,20000
"iPlay, iLearn 10pcs Baby Rattles Toys Set, Infant Grab N Shake Rattle, Sensory Teether, Development Learning Music Toy, Newborn First Birthday Gifts for 0 1 2 3 4 5 6 7 8 9 10 12 Month Babies Boy Girl",9,4.6,29030,800
"NUK Comfy Orthodontic Pacifiers, 0-6 Months, Timeless Collection, 5 Count (Pack of 1)",23,4.7,6114,600
XMWEALTHY Unisex Infant Swaddle Blankets Soft Thick Fleece Knit Baby Girls Boys Stroller Wraps Newborn Baby Accessory Light Pink,21,4.8,0,800
Headband Holder Bows Organizer For Girls Hair Bows Holder Baby Headband Hair Accessories Organizer For Baby Girls Bow Hanger Storage For Girls Hair Bows For Toddler Girls Room Wall Decor (White),189,4.6,1583,3000
"KoolerThings Baby Bassinet, Bedside Sleeper for Baby, Easy Folding Portable Crib with Storage Basket for Newborn, Bedside Bassinet, Comfy Mattress/Travel Bag Included (Bassinet)",19,4.5,1037,100
"mDesign Fabric Hanging Organizer - Over Closet Rod Storage with 7 Shelves and 3 Removable Drawers for Baby Nursery Bedroom Organization - Hold Clothes, Linens, Toys, Accessories - Pink Herringbone",26,4.7,2040,10000
"ULG 1 Pack Over Door Organizer with 5 Large Pockets 10 Mesh Side Pockets, 44 lbs Weight Capacity Hanging Storage Organizer with Clear Window Kids Toys, Shoes, Diapers, Dark Grey, 5 Layers",18,4.6,0,50000
"Baby Car Seat Cover, Infant Carseat Canopy with 3 Layers Windows, Breathable Mesh Peep Window, Kick-Proof Carrier Cover for Boys Girls, Windproof Stroller Cover Shower Gift for Newborn (Elephant)",22,4.8,20023,100
"Aveeno Baby Bathtime Solutions Baby & Me Gift Set with Baby Wash & Shampoo, Calming Baby Bath & Wash, Baby Daily Moisturizing Lotion & Stress Relief Body Wash for Mom, Soap-Free, 4 items",34,4.8,164940,1000
"Pampers Sensitive Water Based Hypoallergenic and Unscented Baby Wipes Combo, 1008 count (Packaging May Vary)",15,4.8,2755,100
"Prohouse 40 PCS Baby Girl Hair Clips, Hair Bows for Girls Toddler Babies Kids Baby, Alligator Clip Hair Accessories",19,4.4,15016,5000
"HOFISH Maternity Nursing Bra for Breastfeeding Pregnancy Wireless Bralette with Pads, Extenders & Clips 3PACK S-XXL",16,3.7,0,5000
"Airplane Footrest Seat Extender for Kids: GEMGO Toddler Airplane Travel Bed, Portable Foot Rest Hammock for Flights - Leg Rest for Baby to Lie Down on Plane Travel Accessories",17,4.4,0,900
"Accmor Hanging Baby Diaper Caddy Organizer, Diaper Stacker, Baby Crib Hanging Classified Storage Bag Organizer for Changing Table, Crib, Playard or Wall & Nursery Organization, White",9,4.4,0,10000
"Glad For Kids Disposable Paper Bibs, 30 Ct - Disposable Bibs - Travel Bibs For Kids, Disposable Kids Bibs With Crumb Catcher",22,4.5,20275,1000
"Rechargeable Baby Nail File, Fansidi Electric Baby Nail Trimmer for Newborn Infant or Toddler Toenail and Fingernail - Girls and Boys Accessory - Extra Replacement Pads Included (Pink)",12,4.7,7294,700
"Dr. Brown’s Folding Baby Bottle Drying Rack for Easy Storage, Dry Nipples, Pacifiers and Other Baby Essentials, BPA-free",8,4.9,0,4000
"6-Piece Silicone Feeding Spoons for First Stage Baby and Infant, Soft-Tip Easy on Gums I Training Spoon | Baby Utensils Feeding Supplies, Dishwasher & Boil-proof",22,4.7,10318,3000
"Simple Joys by Carter's Unisex Babies' Teething Bibs, Pack of 7",84,4.7,3912,600
"Tushbaby - Safety-Certified Hip Seat Baby Carrier - Mom’s Choice Award Winner, Seen on Shark Tank, Ergonomic Carrier & Extenders for Newborns & Toddlers (Carrier, Grey)",29,4.4,21784,800
"ALPINE Muffy Baby Ear Protection for Newborn and Babies up to 36 Months – Noise Reduction Earmuffs for Toddlers and Children – Comfortable Infant Ear Muffs Prevent Hearing Damage & Improve Sleep, Blue",49,4.6,0,50
"The Peanutshell 7 in 1 Baby Play Gym, Activity Center and Tummy Time Mat, Woodland Animals",16,4.8,25864,1000
Boon Cacti Bottle Cleaning Brush Set,28,4.8,16536,1000
"Simple Joys by Carter's Unisex Babies' Cotton Sleeper Gown, Pack of 3",9,4.5,2658,400
"Muslin Carseat Cover for Babies, Metplus Breathable Infant Carseat Cover Lightweight Baby Carrier Cover for Girls Boys, Fit Spring Summer/Hot Days/Warm Weather, Pink Floral",23,4.7,35380,4000
"Simple Joys by Carter's Unisex Babies' Muslin burp cloths, Pack of 7, Grey/White/Black, One Size",11,4.7,5671,100
"2-Pack Baby Silicone Bibs, Waterproof, Easy Wipe Silicone Bib for Babies, Toddlers, Baby Feeding Bibs with Large Food Catcher Pocket, Travel Bibs for Baby Girl, Boy, Food Grade BPA Free (Cloud Nine)",12,4.4,6350,1000
"Burt's Bees Baby Baby Girls' Mittens, No-Scratch Mitts, 100% Organic Cotton, Set of 3",7,4.8,0,800
"Orighty Burp Cloths, Super Soft & Highly Absorbent Coral Fleece, 20 x 10 Inch Gentle & Large Burp Rugs for Baby Sensitive Skin - Burping Cloths for Newborn Essential, 8 Pack",12,4.7,1151,600
"VISBL Baby Girl Headbands and Bows, Newborn Infant Toddler Nylon Hairbands Hair Accessories",104,4.3,5481,50
Pamo Babe Portable Crib for Baby Nursery Center Playard Baby Playpen Travel Crib Diaper Changer with Mattress,32,4.5,3038,1000
"Momcozy Baby Wrap Carrier Slings, Easy to Wear Infant Carrier Slings for Babies Girl and Boy, Adjustable Baby Carriers for Newborn up to 50 lbs, Black",14,4.8,23854,2000
Hudson Baby unisex-baby Cotton and Polyester Bibs,12,4.5,2134,900
Touched by Nature Unisex Baby Organic Cotton Socks,38,4.6,6941,5000
"1080P Baby Car Mirror, Shybaby 4.3'' Baby Car Camera Monitor 170° Wide View, HD Night Vision Function and Reusable Sucker Bracket, Safety Rear Facing Car Set Camera Infants Kids Toddlers Black",5,3.9,8470,2000
"FAREVER Baby Wipe Dispenser, 4 Pack Portable Refillable Wipe Holder, Reusable Lightweight Wipes Container Case Holder for Travel Wet Wipe Pouch, Floral",6,4.6,1764,600
"Konssy Muslin Baby Bibs 6 Pack Baby Bandana Drool Bibs Soft Cotton for Unisex Boys Girls, Absorbent Solid Colors Bibs",18,4.8,0,50
"Pigeon Breast Milk Storage Bag, Disposable Self Standing Bag, 5 Colourful Design, 50 Pcs (Pack of 2), 6 Oz",17,4.7,0,200
"3-Pack Baby Beanies, Baby Hats - Newborn Hats, Baby Boy Hats, Baby Girl Hats, Newborn Beanie, Baby Winter Hat, Baby Hat, Baby Boy Beanie, Baby Girl Beanie, Infant Beanie, Toddler Beanie (Mars, M)",15,4.6,1939,50
Boon Cacti Bottle Cleaning Brush Set,16,4.8,25864,4000
22 PCS Baby Headbands Soft Nylon Hairbands with Bows Girls Hair Accessories for Newborn Infant Toddler Kids Handmade,16,4.8,3450,1000
YEYA Upgrade No Drill Anti Tip Furniture Anchor,42,4.8,34196,4000
"RUVALINO Diaper Bag Backpack, Multifunction Travel Back Pack Maternity Baby Changing Bags, Large Capacity, Waterproof and Stylish, Gray",8,3.9,8470,600
IUMÉ Baby Crawling Pads Anti-Slip Knee Protect Baby’s Knee for Crawling,10,4.6,17167,8000
"Shynerk Baby Car Mirror, Rear Facing Car Seat Mirror Safety for Infant Newborn, Baby Mirror with Wide Rearview, Shatterproof & Easy Assembled Crash Tested",12,4.6,29030,20000
"NUK Comfy Orthodontic Pacifiers, 0-6 Months, Timeless Collection, 5 Count (Pack of 1)",9,4.7,3912,10000
"Tushbaby - Safety-Certified Hip Seat Baby Carrier - Mom’s Choice Award Winner, Seen on Shark Tank, Ergonomic Carrier & Extenders for Newborns & Toddlers (Carrier, Grey)",84,4.7,12352,2000
"Parker Baby Diaper Caddy - Nursery Storage Bin and Car Organizer for Diapers and Baby Wipes - Large, Grey",24,4.6,1458,1000
"JoyDow Baby Car Mirror with Night Light, Safety Rear Facing Car Seat Mirror for Infant Newborn, Wide Crystal Clear View 360° Adjustable, Crash Tested & 100% Shatterproof",20,4.9,1524,500
"Lutron Caseta Wireless Pedestal for Pico Smart Remote, L-PED1-WH, White",9,4.6,0,900
"Eascrozn Baby Pacifier Clip, 6 Pack Silicone Pacifier Holder with One Piece Design for Baby Boy and Girl, BPA Free Soft Flexible Paci Binky Clips",7,4.6,0,100
"hiccapop MiniPod Baby Dome for On the Go | Travel Baby Tent for Beach Protects from Sun, Wind, Bugs | Lightweight Portable Baby Bed, Baby Beach Tent for Baby | On the Go Baby Dome for Outside & Inside",84,4.7,6114,800
XMWEALTHY Unisex Infant Swaddle Blankets Soft Thick Fleece Knit Baby Girls Boys Stroller Wraps Newborn Baby Accessory Light Pink,23,4.6,0,100
"Baby Swaddle Set Newborn - Receiving Headband Blankets and Bow Hat,Newborn Essentials, Soft Nursery Swaddling Blankets，Stretchy Baby Blankets for Girls and Boys Unisex(Light Brown)",17,4.3,1753,1000
"ADOVEL Baby Bassinet Bedside Crib, Pack and Play with Mattress, Diaper Changer and Playards from Newborn to Toddles, Grey",198,4.7,0,3000
"Toy Straps for Baby,RTMOK 4pcs Silicone Setpacifier Clip,Applies to Car Seat Toy,Teether Toy,High Chair,Stroller Accessories,Baby Toy Clips,Cribs,Rocking Chair,Silicone Pacifier Clip",7,4.7,5671,50
"2-Pack Baby Silicone Bibs, Waterproof, Easy Wipe Silicone Bib for Babies, Toddlers, Baby Feeding Bibs with Large Food Catcher Pocket, Travel Bibs for Baby Girl, Boy, Food Grade BPA Free (Cloud Nine)",11,4.6,46714,10000
AMACOOL Battery Operated Stroller Fan Flexible Tripod Clip On Fan with 3 Speeds and Rotatable Handheld Personal Fan for Car Seat Crib Bike Treadmill (Black),29,4.8,50038,3000
"Baby Wipes, Pampers Sensitive Water Based Baby Diaper Wipes, Hypoallergenic and Unscented, 8 Pop-Top Packs with 4 Refill Packs for Dispenser Tub, 864 Total Wipes (Packaging May Vary)",15,4.8,2755,100
"Prohouse 40 PCS Baby Girl Hair Clips, Hair Bows for Girls Toddler Babies Kids Baby, Alligator Clip Hair Accessories",19,4.4,15016,3000
"HOFISH Maternity Nursing Bra for Breastfeeding Pregnancy Wireless Bralette with Pads, Extenders & Clips 3PACK S-XXL",16,3.7,0,1000
"Airplane Footrest Seat Extender for Kids: GEMGO Toddler Airplane Travel Bed, Portable Foot Rest Hammock for Flights - Leg Rest for Baby to Lie Down on Plane Travel Accessories",17,4.4,0,1000
"Accmor Hanging Baby Diaper Caddy Organizer, Diaper Stacker, Baby Crib Hanging Classified Storage Bag Organizer for Changing Table, Crib, Playard or Wall & Nursery Organization, White",39,4.8,23930,1000
"hiccapop OmniBoost Travel Booster Seat with Tray for Baby, Dining Table, Camping, Beach, Grandma’s | Folding Portable Tip-Free Design Straps to Kitchen Chairs",11,4.4,8093,1000
"ONE PIX Backseat Car Organizer Mats Back Seat Organizers and Storage Bag with Touch Screen Tablet Holder for Kids Toddlers Car Seats, Travel Accessories, Road Trip Essentials Kids",85,4.8,9765,1000
"Fisher-Price Baby Portable Bassinet and Play Space On-the-Go Baby Dome with Developmental Toys and Canopy, Windmill",9,4.8,11124,3000
"8 Pack Large Burp Cloths for Baby - 20"" by 10"" Ultra Absorbent Burping Cloth, Washcloths, Newborn Towel - Milk Spit Up Rags Burp Clothes for Unisex, Boy, Girl (White)",12,4.8,23854,8000
Touched by Nature Unisex Baby Organic Cotton Socks,10,4.8,13823,1000
Hudson Baby Unisex Baby Plush Animal Face Bathrobe,23,4.8,28753,100
"iPlay, iLearn 10pcs Baby Rattles Toys Set, Infant Grab N Shake Rattle, Sensory Teether, Development Learning Music Toy, Newborn First Birthday Gifts for 0 1 2 3 4 5 6 7 8 9 10 12 Month Babies Boy Girl",16,4.6,7959,1000
"b&h Digital Baby Thermometer, The Infant Baby Bath Floating Toy Safety Temperature Water Thermometer (Classic Duck)",15,4.2,0,6000
Baby Spiral Hanging Stroller and Car Seat Toys for Babies 0-6 Months Newborn Plush Activity Toys for Bed Bassinet Crib Baby Carrier Gifts (Bee),22,4.5,20275,1000
"Rechargeable Baby Nail File, Fansidi Electric Baby Nail Trimmer for Newborn Infant or Toddler Toenail and Fingernail - Girls and Boys Accessory - Extra Replacement Pads Included (Pink)",12,4.4,6350,1000
"Burt's Bees Baby Baby Girls' Mittens, No-Scratch Mitts, 100% Organic Cotton, Set of 3",10,4.8,12250,3000
Hudson Baby Unisex Baby Cotton Terry Drooler Bibs With Fiber Filling,32,4.8,36864,700
Zaples Baby Non Slip Grip Ankle Socks with Non Skid Soles for Infants Toddlers Kids Boys Girls,15,4.6,1409,300
"Gaiatop Baby Stroller Fan, 4000mAh Oscillating Mini Portable Fan with Lights, 4 Speeds Battery Operated 360° Rotate Flexible Tripod Small Clip On Handheld Desk Fan for Car Seat Crib Travel Black",17,4.8,0,900
"Baby Hair Clips, 42PCS 2"" Fully Lined Hair Bows for Girls, Toddler Hair Accessories for Girls, Alligator Hair Clips for Girls Toddlers Baby Kids Teens (21 Colors in Pairs)",5,4.6,15006,3000
"Exquisite Buggy My Sweet Baby Disappearing Magic Bottles - Includes 1 Milk, 1 Juice Bottle with Pacifier for Baby Doll (Colorful)",7,4.6,0,300
"The Peanutshell 7 in 1 Baby Play Gym, Activity Center and Tummy Time Mat, Woodland Animals",49,4.5,0,50
2 Pack Ultra Warm Sherpa Plush Baby Sleeping Swaddle Wrap - Newborn Essentials Must Haves for 0-6 Months - Baby Shower Registry Search Gifts for Boys Girls - Baby Stuff Accessories (Grey and White),18,4.5,3038,50
Elesa Miracle 60pcs Baby Girl Mini Hair Claw Clips Flower Hair Bangs Pin Baby Girl Hair Accessories Clips,6,4.8,3679,1000
"HAILI XMGQ Baby Teething Toys, Silicone Baby Teether Freezer BPA Free, Soothe Babies Teething Relief Sore Gums, Banana Finger Toothbrush, Fruit Shape Giraffe Teether Set for Infant Boys and Girls",9,4.0,2088,800
Head Support for Stroller Car Seat - Head Band Strap Headrest for Sleeping Traveling for Toddler Kids Children Child Baby Infant,5,4.8,0,4000
"Tetthing Toys for Babies 0-6 Months - Baby Teething Toys - Never Drop Silicone Nipple Like Baby Teether & Infant Toys - Teethers for Babies 0-6 Months - Motor Skill, Gum & Teeth Development (Gray)",5,4.8,24237,3000
Gerber baby-girls 8-pack Short Sleeve Onesies Bodysuits,19,4.4,0,3000
"Glad For Kids Disposable Paper Bibs, 30 Ct - Disposable Bibs - Travel Bibs For Kids, Disposable Kids Bibs With Crumb Catcher",9,4.7,35380,3000
"Simple Joys by Carter's Unisex Babies' Muslin burp cloths, Pack of 7, Grey/White/Black, One Size",23,4.8,11472,2000
