product_name,product_price,rating,global_review,past_month_order
"Portable Bottle Warmer Set, Little Bo Baby Portable Warmer with Baby Bottle and Adapter Travel Bottle Warmer for Breastmilk and Formula Bottle Warmer Digital Display Perfect",9,4.4,0,1000
"Synrroe Muslin Burp Cloths 4 Pack Large 20"" by 10"" 100% Cotton 6 Layers Extra Absorbent and Soft",13,4.4,3827,800
"10 Pieces Cabinet Locks for Babies, U-Shaped Proofing Drawers Safety Child Locks Adjustable, Easy to Use Childproof Latch for Knob Handle on Kitchen Door Storage Cupboard Closet Dresser (White)",9,4.7,6334,1000
"YIVEKO Baby Nail Kit, 4-in-1 Baby Nail Care Set with Cute Case, Baby Nail Clippers, Scissors, Nail File & Tweezers, Baby Manicure Kit and Pedicure kit for Newborn, Infant, Toddler, Kids-Owl Green",24,4.6,7727,1000
"Homedics MyBaby SoundSpa Lullaby Sound Machine & Projector – Baby Sleep Machine Plays 6 Sounds & Lullabies, Projects Soothing Images - Auto-Off Timer Perfect for Naptime, Adjustable White Noise Volume",28,4.5,17579,900
"Simple Joys by Carter's Unisex Babies' Cotton Sleeper Gown, Pack of 3",9,4.8,8880,6000
Corner Protectors Guards - Furniture Corner Guard & Edge Safety Bumpers - Baby Proof Bumper & Cushion to Cover Sharp Furniture & Table Edges - Clear and Transparent - (12 Pack),25,4.7,29335,1000
"Baby Changing Table with Wheels, Maydolly Portable Adjustable Height Folding Diaper Station with Nursery Organizer & Storage Rack for Newborn Baby and Infant (Dark Grey)",89,4.7,0,400
"VFOLO Baby Bath Seat, Infant Bath Seat, Have Temperature Display Bar and Non-Slip Soft Mat，3 Bath Toys, 4 Upgraded Suction Cups are More Stable, Babies Shower Chair for Babies 6 Months & Up",39,4.5,0,50
"miu Care Medical Grade Baby Nasal Aspirator Electric, Electric Nose Suction for Baby with 2 Silicone Tips, Battery Operated Nose Sucker with Cleaning Brush and Carrying Pouch",39,4.0,0,4000
Alpine Muffy Baby Ear Protection for Babies and Toddlers up to 36 Months - CE & ANSI Certified - Noise Reduction Earmuffs - Comfortable Headphones Against Hearing Damage & Improves Sleep - Green,29,4.4,21729,500
"Baby Playpen with Mat 71 x 59 inch Baby Playpen for Babies and Toddlers, Extra Large Baby Playyard for Indoor & Outdoor Activity, with Soft Breathable Mesh for Kids Center",109,4.7,0,3000
"Fisher-Price Portable Baby Chair Sit-Me-Up Floor Seat With Developmental Toys & Machine Washable Seat Pad, Honeydew Drop",42,4.7,54708,3000
Small photo album holds 24 4x6 photos,13,4.5,2668,1000
"Doli Yearning Upgrade Baby Bath Thermometer Room Temperature| Water Thermometer|Kids' Bathroom Safety Products| Baby Bath(Seal Shape)℃/℉, LCD",85,4.8,9761,3000
"Fisher-Price Baby Portable Bassinet and Play Space On-the-Go Baby Dome with Developmental Toys and Canopy, Windmill",19,4.6,28391,100
"Baby Nail Clippers 20 in 1 by Royal Angels | Safe Electric Baby Nail Trimmer, Baby Nail File Kit, Additional Replacement Heads, Newborn Toddler Toes and Fingernails, Trim and Polish (Pink)",159,4.2,0,1000
"Sense-U Smart 2K Video Baby Monitor, FSA&HSA Eligible, Pan/Tilt, Person/Baby Crying/Motion Detection, 2-Way Talk, Night Vision, Background Audio, No Monthly Fee (Compatible with Smart Baby Monitor)",39,4.6,2204,400
"HEYVALUE Baby Food Maker, 13-in-1 Baby Food Processor Gift Sets for Baby Food, Fruit, Vegatable, Meat, with Baby Food Containers, Baby Food Freezer Tray, Silicone Spoons, Silicone Spatula (Gray)",39,4.2,0,3000
Baby Bather Plus - Bath Support with Thermometer for Bathtub or Sink (0-6 Months) Slip-Resistant & Ergonomic for Newborn Infant (Aqua) - Jool Baby,13,4.4,5652,5000
Munchkin® Shhh…™ Portable Baby Sleep Soother White Noise Sound Machine and Night Light,34,4.6,0,9000
Hatch Rest Go | Portable Sound Machine for Babies and Kids | Baby Sleep Soother | 10 Soothing Sounds | White Noise | Shush | Travel | Registry Gift | Baby Shower | Clips on Baby Stroller | Slate,34,4.4,19747,500
Baby Shusher The Sleep Miracle Sound Machine Rhythmic Human Voice Shushes Baby to Sleep Every Time The Quickest Way to Get Baby to Sleep,249,4.7,1716,1000
"Maxi-Cosi 6-in-1 Minla High Chair, 6 Modes for Years of Growth, Essential Grey",44,4.5,0,50
"Baby Play Mat, Soft Foam Play Mats for Floor, Foldable Waterproof Playmats for Babies and Toddlers Kids, Reversible Baby Crawling Mat for Indoor and Outdoor, Tropical Boho Geometric Design, 79''x51''",29,4.5,0,100
"RowinsyDD 32 Pack Glass Baby Food Storage Containers, 4 oz Leakproof Baby Food Jars with Lids, Small Glass Food Containers for Infant Baby Food, Freezer & Microwave Safe, BPA Free",26,4.5,0,2000
"Baby Grooming Kit, Infant Safety Care Set with Baby Electric Nose Aspirator，Baby Hair Brush Comb Nail Clipper Nasal Aspirator Ear Cleaner,Baby Essentials Kit for Newborn Girls Boys (21 Pc Green Kit)",6,4.8,2753,900
"Bumco Baby Diaper Rash Cream Applicator - Baby Bum Brush Diaper Cream Spatula for Butt Paste Diaper Cream - Newborn Baby Essentials, Perfect for Baby Registry, Baby Shower Gifts - Gray",11,4.8,2261,8000
"Miraloop Teething Toy for Baby 0-6, 12, 18 Months Infant, Jellydog Never Drop Food Grade Silicone Rocking Teether, Prevent Choking & Odorless, Less Dust and Hair Adhesion, Baby Gift, Mint Green",21,4.8,17443,800
Safety 1st Deluxe 25-Piece Baby Healthcare and Grooming Kit (Arctic Blue),15,4.7,2954,4000
"Orighty Baby Washcloths 50-Pack, Microfiber Coral Fleece Baby Face Towels, Soft and Absorbent Wash Cloths for Newborns, Infants and Toddlers, Gentle on Delicate Skin for Face Hands and Body, 7x9 Inch",33,4.5,0,100
"Koalababy Large Flow Electric Nasal Aspirator, 2023 Newest Nose Sucker for Baby, Booger Sucker, Nose Cleaner for Toddlers with 3 Silicone Tips, 3 Suction Levels, Music & Light Soothing Function",129,4.2,0,100
"Baby Playpen 79”×71"" with Mat, Extra Large Play Pen for Babies and Toddlers, No Gap Baby Fence Area with Breathable Mesh, Safety Baby Gate Playpen",59,4.3,0,100
"5 in 1 Thick and Plush Play Gym, Tummy Time Mat, Play Mat for Babies and Toddlers, Activity Gym, Baby Activity Center from Baby to Toddler, Ball Pit, Soft Plush Pet Bed, with 5 Toys(Beige)",39,4.3,0,200
"iHealth Digital Ear Thermometer, Fast, Accurate, Gentle Results in 1 Second, Infrared, Pre-Warmed Tip with 21 Disposable Lens Filters & Organizer Case for Kids, Babies, Toddlers & Adults Home Use PT5",6,4.8,4755,1000
"BEBECAN Teething Sticks for Babies 0-36 Months - Super Soft Silicone Teethers in 6 Vibrant Colors, Infant Teething Relief, Multicolored Teething Toys Baby Gift Teethers for Babies 6-12 Months",19,4.7,0,2000
"Sense-U Organic Baby Swaddle Sleep Sacks - Floral Design, Ergonomic Design, Soft & Cozy Newborn Infant Adjustable Swaddle Blanket Wrap (0-3 Months)",3,4.5,0,50
"Baby Bath Brush, JEXCULL Baby Cradle Cap Brush for Babies Newborns Premium Silicone Baby Scalp Scrubber Massage Exfoliator Brush Multifunctional Baby Bath Essentials",15,4.8,1727,10000
"LaPettieCo Handmade Baby Headbands Stretchy Nylon Headband with Bows for Infant Baby Toddler Girls- Pack of 10, Colorful, 5 x 5 x 0.7 inches",15,4.6,8221,500
"Baby Bath Books, Nontoxic Fabric Soft Baby Cloth Books, Early Education Toys, Waterproof Baby Books for Toddler, Infants Perfect Shower Toys, Kids Bath Toys Birthday Gift (Pack of 8)",49,4.8,0,600
"Baby Play Mat Activity Gym - Tummy Time Mat for Babies 0-6 Months with 15 Activities, Machine Washable, 850 X 760mm Floor Play Space - Ideal for Infant Development & Baby Shower Gifts",4,4.7,104064,100
Nuby Ice Gel Teether Keys,25,4.4,0,10000
"Nasal Aspirator for Baby, MOMYMUST Electric Baby Nose Cleaner with Self-Cleaning Function, Baby Nasal Aspirator with 3 Levels of Suction, Music and Light, 2 Nose-Tips, 60 Days Use Time",30,4.4,0,1000
"Jovow Baby Gym with Kick and Play Piano,Baby Play Mat Tummy Time Baby Activity Gym Mat with 5 Infant Learning Sensory for Baby, Music and Lights Boy or Girl Gifts for Newborn (Green)",129,4.2,0,300
"Baby Playpen 79”×71"" with Mat, Extra Large Play Pen for Babies and Toddlers, No Gap Baby Fence Area with Breathable Mesh, Safety Baby Gate Playpen",39,4.4,2658,500
"Baby Sound Machine, Momcozy White Noise Machine for Baby Sleeping with Night Light, Toddler Sleep Trainer with 34 Soothing Sounds, Timer, App Remote Control, Personal Sleep Routine (Blue)",18,4.7,4736,1000
BlueMello Baby Swaddle Blanket | Ultra-Soft Plush Essential for Infants 0-6 Months | Receiving Swaddling Wrap White | Ideal Newborn Registry and Toddler Boy Accessories | Perfect Baby Girl Shower Gift,117,4.6,3963,3000
"Amazon Basics Portable Foldable Photo Studio Box with LED Light, 1 Count (Pack of 1), Black, 25 x 30 x 25 Inches",19,4.8,1577,700
"MINIBOO Rayon from Bamboo Hooded Baby Towel – Ultra Soft and Super Absorbent Baby Bath Towels for Newborns, Infants and Toddlers – Suitable as Baby Gifts",42,4.3,11200,400
"GROWNSY Nasal Aspirator for Baby, Electric Nose Aspirator for Toddler, Baby Nose Sucker, Automatic Nose Cleaner with 3 Silicone Tips, Adjustable Suctions, Music and Light Soothing Function (Blue)",16,4.8,9664,3000
"Aveeno Baby Calming Comfort Bath & Lotion Set, Nighttime Baby Skin Care Products with Natural Oat, Lavender & Vanilla Scents, Paraben-, Phthalate- & Phenoxyethanol-Free, 2 Items",9,4.5,0,10000
"POPYJAN Baby Healthcare and Grooming Kit for Newborn Kids, 36PCS Upgraded Safety Care Kit, Nursery Health Set, Products Blue-18pcs",99,4.8,2217,3000
"Frida Baby Ultimate Baby Kit | The complete baby health & wellness, grooming, and teething kit",69,4.7,11783,1000
Papablic Baby Bottle Electric Steam Sterilizer and Dryer,49,4.4,0,2000
"Portable Bottle Warmer Set, Little Bo Baby Portable Warmer with Baby Bottle and Adapter Travel Bottle Warmer for Breastmilk and Formula Bottle Warmer Digital Display Perfect",9,4.8,29756,1000
"Synrroe Muslin Burp Cloths 4 Pack Large 20"" by 10"" 100% Cotton 6 Layers Extra Absorbent and Soft",13,4.4,3827,1000
"10 Pieces Cabinet Locks for Babies, U-Shaped Proofing Drawers Safety Child Locks Adjustable, Easy to Use Childproof Latch for Knob Handle on Kitchen Door Storage Cupboard Closet Dresser (White)",9,4.7,6334,800
"YIVEKO Baby Nail Kit, 4-in-1 Baby Nail Care Set with Cute Case, Baby Nail Clippers, Scissors, Nail File & Tweezers, Baby Manicure Kit and Pedicure kit for Newborn, Infant, Toddler, Kids-Owl Green",24,4.6,7727,1000
"Homedics MyBaby SoundSpa Lullaby Sound Machine & Projector – Baby Sleep Machine Plays 6 Sounds & Lullabies, Projects Soothing Images - Auto-Off Timer Perfect for Naptime, Adjustable White Noise Volume",28,4.8,16519,1000
"Simple Joys by Carter's Unisex Babies' Cotton Sleeper Gown, Pack of 3",9,4.5,17579,900
Corner Protectors Guards - Furniture Corner Guard & Edge Safety Bumpers - Baby Proof Bumper & Cushion to Cover Sharp Furniture & Table Edges - Clear and Transparent - (12 Pack),25,4.8,8880,6000
"Derebir Baby Camera Mount Stand Flexible Baby Monitor Holder Shelf Compatible with BOIFUN/TECGUUD/ieGeek Baby Monitor,Baby Camera Stand More Safety(33.3inch/Camera Not Included)",20,4.5,1520,400
"Punch-Free Install Retractable Baby Gate, 33"" Tall, Extends up to 55"" Wide, Indoor/Outdoor Baby Gate, Child Gate Stair Gate for Stairs, Doorways, Hallways, Grey",29,4.0,0,3000
"EASICUTI Baby Tongue Cleaner, Baby Toothbrush, 42Pcs Disposable Infant Toothbrush Clean Baby Mouth,Gauze Gum Cleaner Baby Oral Cleaning Stick Dental Care for 0-36 Month Baby+Free 1 Finger Toothbrush",9,4.6,4690,500
"Maxi-Cosi 6-in-1 Minla High Chair, 6 Modes for Years of Growth, Essential Grey",249,4.7,1716,10000
"HIPHOP PANDA Baby Washcloths, Rayon Made from Bamboo - 2 Layer Soft Absorbent Newborn Bath Face Towel - Natural Baby Wipes for Delicate Skin - Baby Registry as Shower(6 Pack)",9,4.8,25437,4000
Alpine Muffy Baby Ear Protection for Babies and Toddlers up to 36 Months - CE & ANSI Certified - Noise Reduction Earmuffs - Comfortable Headphones Against Hearing Damage & Improves Sleep - Green,29,4.4,21729,500
Your One-Stop Shop for Diaper Essentials!,109,4.7,0,3000
"Baby Playpen with Mat 71 x 59 inch Baby Playpen for Babies and Toddlers, Extra Large Baby Playyard for Indoor & Outdoor Activity, with Soft Breathable Mesh for Kids Center",42,4.7,54708,3000
"Fisher-Price Portable Baby Chair Sit-Me-Up Floor Seat With Developmental Toys & Machine Washable Seat Pad, Honeydew Drop",13,4.5,2668,1000
"Doli Yearning Upgrade Baby Bath Thermometer Room Temperature| Water Thermometer|Kids' Bathroom Safety Products| Baby Bath(Seal Shape)℃/℉, LCD",85,4.8,9761,3000
"Fisher-Price Baby Portable Bassinet and Play Space On-the-Go Baby Dome with Developmental Toys and Canopy, Windmill",19,4.6,28391,100
"Baby Nail Clippers 20 in 1 by Royal Angels | Safe Electric Baby Nail Trimmer, Baby Nail File Kit, Additional Replacement Heads, Newborn Toddler Toes and Fingernails, Trim and Polish (Pink)",159,4.2,0,1000
"Sense-U Smart 2K Video Baby Monitor, FSA&HSA Eligible, Pan/Tilt, Person/Baby Crying/Motion Detection, 2-Way Talk, Night Vision, Background Audio, No Monthly Fee (Compatible with Smart Baby Monitor)",39,4.6,2204,1000
"HEYVALUE Baby Food Maker, 13-in-1 Baby Food Processor Gift Sets for Baby Food, Fruit, Vegatable, Meat, with Baby Food Containers, Baby Food Freezer Tray, Silicone Spoons, Silicone Spatula (Gray)",10,4.8,13823,500
Hudson Baby Unisex Baby Plush Animal Face Bathrobe,28,4.6,4818,50
"Lupantte Baby Healthcare and Grooming Kit, 24 in 1 Baby Electric Nail Trimmer Set, Nursery Care Kit, Toddler Nail Clippers, Medicine Dispenser, Infant Comb, Brush, Baby Care Products",69,5.0,0,2000
Expectant Daddy Gift Box for The New Daddy or Daddy to Be Pregnancy Gift,39,4.5,0,1000
"VFOLO Baby Bath Seat, Infant Bath Seat, Have Temperature Display Bar and Non-Slip Soft Mat，3 Bath Toys, 4 Upgraded Suction Cups are More Stable, Babies Shower Chair for Babies 6 Months & Up",62,4.6,0,400
Pamo Babe Portable Crib Baby Playpen with Mattress and Carry Bag (Black),69,4.4,0,5000
"BOLOLO Portable Milk Warmer with Super Fast Charging and Cordless, Instant breastmilk, Formula or Water Warmer with 10 Ounces Big Capacity, Baby Flask for Vehicle,car,Airplane Journey",39,4.2,0,9000
Baby Bather Plus - Bath Support with Thermometer for Bathtub or Sink (0-6 Months) Slip-Resistant & Ergonomic for Newborn Infant (Aqua) - Jool Baby,34,4.6,0,2000
Hatch Rest Go | Portable Sound Machine for Babies and Kids | Baby Sleep Soother | 10 Soothing Sounds | White Noise | Shush | Travel | Registry Gift | Baby Shower | Clips on Baby Stroller | Slate,34,4.4,19747,1000
Baby Shusher The Sleep Miracle Sound Machine Rhythmic Human Voice Shushes Baby to Sleep Every Time The Quickest Way to Get Baby to Sleep,6,4.8,2753,1000
"Bumco Baby Diaper Rash Cream Applicator - Baby Bum Brush Diaper Cream Spatula for Butt Paste Diaper Cream - Newborn Baby Essentials, Perfect for Baby Registry, Baby Shower Gifts - Gray",89,4.6,0,1000
"Jimglo Baby Bouncer, Portable Infant Bouncer Seat for Babies, Newborn Bouncy with Mesh, Foldable, Beige",44,4.5,0,900
"Baby Play Mat, Soft Foam Play Mats for Floor, Foldable Waterproof Playmats for Babies and Toddlers Kids, Reversible Baby Crawling Mat for Indoor and Outdoor, Tropical Boho Geometric Design, 79''x51''",9,4.8,5577,8000
"Tiny Twinkle Mess Proof Baby Bib - Waterproof Baby Apron - Machine Washable - PVC, BPA, & Phthalate Free - Great Travel Bib…",9,4.7,3907,800
"Tiny Twinkle Mess Proof Baby Bib, Cute Full Sleeve Bib Outfit, Waterproof Bibs for Toddlers, Machine Washable, Tug Proof",11,4.8,2261,100
"Miraloop Teething Toy for Baby 0-6, 12, 18 Months Infant, Jellydog Never Drop Food Grade Silicone Rocking Teether, Prevent Choking & Odorless, Less Dust and Hair Adhesion, Baby Gift, Mint Green",21,4.8,17443,200
Safety 1st Deluxe 25-Piece Baby Healthcare and Grooming Kit (Arctic Blue),15,4.7,2954,2000
"Orighty Baby Washcloths 50-Pack, Microfiber Coral Fleece Baby Face Towels, Soft and Absorbent Wash Cloths for Newborns, Infants and Toddlers, Gentle on Delicate Skin for Face Hands and Body, 7x9 Inch",6,4.8,4755,10000
"BEBECAN Teething Sticks for Babies 0-36 Months - Super Soft Silicone Teethers in 6 Vibrant Colors, Infant Teething Relief, Multicolored Teething Toys Baby Gift Teethers for Babies 6-12 Months",19,4.7,0,500
"Sense-U Organic Baby Swaddle Sleep Sacks - Floral Design, Ergonomic Design, Soft & Cozy Newborn Infant Adjustable Swaddle Blanket Wrap (0-3 Months)",3,4.5,0,300
"Baby Bath Brush, JEXCULL Baby Cradle Cap Brush for Babies Newborns Premium Silicone Baby Scalp Scrubber Massage Exfoliator Brush Multifunctional Baby Bath Essentials",15,4.6,8221,600
"Baby Bath Books, Nontoxic Fabric Soft Baby Cloth Books, Early Education Toys, Waterproof Baby Books for Toddler, Infants Perfect Shower Toys, Kids Bath Toys Birthday Gift (Pack of 8)",4,4.7,104063,100
Nuby Ice Gel Teether Keys,25,4.4,0,10000
"Nasal Aspirator for Baby, MOMYMUST Electric Baby Nose Cleaner with Self-Cleaning Function, Baby Nasal Aspirator with 3 Levels of Suction, Music and Light, 2 Nose-Tips, 60 Days Use Time",117,4.6,3963,1000
"Amazon Basics Portable Foldable Photo Studio Box with LED Light, 1 Count (Pack of 1), Black, 25 x 30 x 25 Inches",30,4.4,0,500
"Jovow Baby Gym with Kick and Play Piano,Baby Play Mat Tummy Time Baby Activity Gym Mat with 5 Infant Learning Sensory for Baby, Music and Lights Boy or Girl Gifts for Newborn (Green)",129,4.2,0,1000
"Baby Playpen 79”×71"" with Mat, Extra Large Play Pen for Babies and Toddlers, No Gap Baby Fence Area with Breathable Mesh, Safety Baby Gate Playpen",39,4.4,2658,3000
"Baby Sound Machine, Momcozy White Noise Machine for Baby Sleeping with Night Light, Toddler Sleep Trainer with 34 Soothing Sounds, Timer, App Remote Control, Personal Sleep Routine (Blue)",18,4.7,4736,700
BlueMello Baby Swaddle Blanket | Ultra-Soft Plush Essential for Infants 0-6 Months | Receiving Swaddling Wrap White | Ideal Newborn Registry and Toddler Boy Accessories | Perfect Baby Girl Shower Gift,19,4.8,1577,1000
"MINIBOO Rayon from Bamboo Hooded Baby Towel – Ultra Soft and Super Absorbent Baby Bath Towels for Newborns, Infants and Toddlers – Suitable as Baby Gifts",42,4.3,11200,700
"GROWNSY Nasal Aspirator for Baby, Electric Nose Aspirator for Toddler, Baby Nose Sucker, Automatic Nose Cleaner with 3 Silicone Tips, Adjustable Suctions, Music and Light Soothing Function (Blue)",16,4.8,9664,400
"Aveeno Baby Calming Comfort Bath & Lotion Set, Nighttime Baby Skin Care Products with Natural Oat, Lavender & Vanilla Scents, Paraben-, Phthalate- & Phenoxyethanol-Free, 2 Items",9,4.5,0,3000
"POPYJAN Baby Healthcare and Grooming Kit for Newborn Kids, 36PCS Upgraded Safety Care Kit, Nursery Health Set, Products Blue-18pcs",28,4.8,16519,900
"Simple Joys by Carter's Unisex Babies' Cotton Sleeper Gown, Pack of 3",29,4.6,1035,500
"Lictin Baby Healthcare and Grooming Kit, 26 in 1 Rechargeable Nail Trimmer Electric Set,Safe File with Auto Light, Newborn Nursery Health Care Portable Safety Set for Infant Toddlers Boys Girls, Grey",99,4.8,2217,200
"Frida Baby Ultimate Baby Kit | The complete baby health & wellness, grooming, and teething kit",69,4.7,11783,10000
Papablic Baby Bottle Electric Steam Sterilizer and Dryer,14,4.6,11613,800
"UnbuckleMe Car Seat Buckle Release Tool - Easy Opener Aid for Arthritis, Long Nails, Older Kids - Button Pusher for Infant, Toddler, Convertible 5 pt Harness car Seats - As Seen on Shark Tank (Lime)",9,4.4,0,3000
"3 in 1 Baby Booger Remover and Baby Ear Cleaner Tool Baby Nose Cleaner with Soft Silicone End Dual Ear Wax and Snot Remover Safe Nasal Picker for Newborns Infants & Toddlers, BPA Free",27,4.7,0,50
"PoeticEHome Ultra-Soft 100% Pure Bamboo Dry Baby Wipes for Sensitive Skin - Unscented & Unbleached Facial Tissue Cloths, Hypoallergenic, 2X Softer Than Cotton - Wet or Dry Use, 400 Count",9,4.8,29756,1000
"Synrroe Muslin Burp Cloths 4 Pack Large 20"" by 10"" 100% Cotton 6 Layers Extra Absorbent and Soft",13,4.4,0,1000
"Baby Dove Sensitive Skin Care Baby Wash Fragrance Free Moisture For Baby Bath Time Fragrance Free and Hypoallergenic, Washes Away Bacteria 34 oz",13,4.4,3827,2000
"10 Pieces Cabinet Locks for Babies, U-Shaped Proofing Drawers Safety Child Locks Adjustable, Easy to Use Childproof Latch for Knob Handle on Kitchen Door Storage Cupboard Closet Dresser (White)",29,4.7,6334,9000
Pamo Babe All-Terrain Wagon Stroller Tandem Stroller (Brown),239,3.9,0,400
"Baby Changing Table with Wheels, Maydolly Portable Adjustable Height Folding Diaper Station with Nursery Organizer & Storage Rack for Newborn Baby and Infant (Dark Grey)",89,4.7,0,50
"VFOLO Baby Bath Seat, Infant Bath Seat, Have Temperature Display Bar and Non-Slip Soft Mat，3 Bath Toys, 4 Upgraded Suction Cups are More Stable, Babies Shower Chair for Babies 6 Months & Up",39,4.5,0,10000
"HIPHOP PANDA Baby Washcloths, Rayon Made from Bamboo - 2 Layer Soft Absorbent Newborn Bath Face Towel - Natural Baby Wipes for Delicate Skin - Baby Registry as Shower(6 Pack)",9,4.8,25437,4000
Alpine Muffy Baby Ear Protection for Babies and Toddlers up to 36 Months - CE & ANSI Certified - Noise Reduction Earmuffs - Comfortable Headphones Against Hearing Damage & Improves Sleep - Green,29,4.4,21728,500
"Baby Playpen with Mat 71 x 59 inch Baby Playpen for Babies and Toddlers, Extra Large Baby Playyard for Indoor & Outdoor Activity, with Soft Breathable Mesh for Kids Center",109,4.7,0,3000
Your One-Stop Shop for Diaper Essentials!,9,4.6,4690,3000
"EASICUTI Baby Tongue Cleaner, Baby Toothbrush, 42Pcs Disposable Infant Toothbrush Clean Baby Mouth,Gauze Gum Cleaner Baby Oral Cleaning Stick Dental Care for 0-36 Month Baby+Free 1 Finger Toothbrush",13,4.5,2668,1000
"Doli Yearning Upgrade Baby Bath Thermometer Room Temperature| Water Thermometer|Kids' Bathroom Safety Products| Baby Bath(Seal Shape)℃/℉, LCD",85,4.8,9761,3000
"Fisher-Price Baby Portable Bassinet and Play Space On-the-Go Baby Dome with Developmental Toys and Canopy, Windmill",19,4.6,28390,100
"Baby Nail Clippers 20 in 1 by Royal Angels | Safe Electric Baby Nail Trimmer, Baby Nail File Kit, Additional Replacement Heads, Newborn Toddler Toes and Fingernails, Trim and Polish (Pink)",159,4.2,0,1000
"Sense-U Smart 2K Video Baby Monitor, FSA&HSA Eligible, Pan/Tilt, Person/Baby Crying/Motion Detection, 2-Way Talk, Night Vision, Background Audio, No Monthly Fee (Compatible with Smart Baby Monitor)",37,4.6,2204,300
"HEYVALUE Baby Food Maker, 13-in-1 Baby Food Processor Gift Sets for Baby Food, Fruit, Vegatable, Meat, with Baby Food Containers, Baby Food Freezer Tray, Silicone Spoons, Silicone Spatula (Gray)",14,4.8,0,500
Niceye Handmade Baby Headbands Soft Stretchy Nylon Hair Bands with Bows for Newborn Infant Baby Toddler Girls- Pack of 6,28,4.6,4818,400
"Lupantte Baby Healthcare and Grooming Kit, 24 in 1 Baby Electric Nail Trimmer Set, Nursery Care Kit, Toddler Nail Clippers, Medicine Dispenser, Infant Comb, Brush, Baby Care Products",39,4.2,0,500
Baby Bather Plus - Bath Support with Thermometer for Bathtub or Sink (0-6 Months) Slip-Resistant & Ergonomic for Newborn Infant (Aqua) - Jool Baby,249,4.7,1716,1000
"Maxi-Cosi 6-in-1 Minla High Chair, 6 Modes for Years of Growth, Essential Grey",44,4.5,0,50
"Baby Play Mat, Soft Foam Play Mats for Floor, Foldable Waterproof Playmats for Babies and Toddlers Kids, Reversible Baby Crawling Mat for Indoor and Outdoor, Tropical Boho Geometric Design, 79''x51''",29,4.5,0,100
"RowinsyDD 32 Pack Glass Baby Food Storage Containers, 4 oz Leakproof Baby Food Jars with Lids, Small Glass Food Containers for Infant Baby Food, Freezer & Microwave Safe, BPA Free",39,4.3,0,5000
"iHealth Digital Ear Thermometer, Fast, Accurate, Gentle Results in 1 Second, Infrared, Pre-Warmed Tip with 21 Disposable Lens Filters & Organizer Case for Kids, Babies, Toddlers & Adults Home Use PT5",34,4.6,0,9000
Hatch Rest Go | Portable Sound Machine for Babies and Kids | Baby Sleep Soother | 10 Soothing Sounds | White Noise | Shush | Travel | Registry Gift | Baby Shower | Clips on Baby Stroller | Slate,34,4.4,19747,2000
Baby Shusher The Sleep Miracle Sound Machine Rhythmic Human Voice Shushes Baby to Sleep Every Time The Quickest Way to Get Baby to Sleep,6,4.8,2753,900
"Bumco Baby Diaper Rash Cream Applicator - Baby Bum Brush Diaper Cream Spatula for Butt Paste Diaper Cream - Newborn Baby Essentials, Perfect for Baby Registry, Baby Shower Gifts - Gray",11,4.8,2261,100
"Miraloop Teething Toy for Baby 0-6, 12, 18 Months Infant, Jellydog Never Drop Food Grade Silicone Rocking Teether, Prevent Choking & Odorless, Less Dust and Hair Adhesion, Baby Gift, Mint Green",89,4.6,0,8000
"Jimglo Baby Bouncer, Portable Infant Bouncer Seat for Babies, Newborn Bouncy with Mesh, Foldable, Pink",61,4.9,0,800
"Handmade Baby Changing Basket with a Soft Changing Pad and Waterproof Cover, Cotton Moses Basket, Changing Table Topper for Dresser | Boho Bassinet, Handmade Crochet Basket,Baby Lounger",39,4.0,0,100
"miu Care Medical Grade Baby Nasal Aspirator Electric, Electric Nose Suction for Baby with 2 Silicone Tips, Battery Operated Nose Sucker with Cleaning Brush and Carrying Pouch",13,4.6,5227,200
"Coolplay Baby's First Non-Toxic Soft Cloth Book Set, Crinkle Books Friction with Rustling Sound - Pack of 8",21,4.8,17443,1000
Safety 1st Deluxe 25-Piece Baby Healthcare and Grooming Kit (Arctic Blue),6,4.8,4755,2000
"BEBECAN Teething Sticks for Babies 0-36 Months - Super Soft Silicone Teethers in 6 Vibrant Colors, Infant Teething Relief, Multicolored Teething Toys Baby Gift Teethers for Babies 6-12 Months",15,4.7,2954,10000
"Orighty Baby Washcloths 50-Pack, Microfiber Coral Fleece Baby Face Towels, Soft and Absorbent Wash Cloths for Newborns, Infants and Toddlers, Gentle on Delicate Skin for Face Hands and Body, 7x9 Inch",19,4.7,0,500
"Sense-U Organic Baby Swaddle Sleep Sacks - Floral Design, Ergonomic Design, Soft & Cozy Newborn Infant Adjustable Swaddle Blanket Wrap (0-3 Months)",3,4.5,0,300
